### ISSUE TITLE
tsh proxy ssh handshake failure

### ISSUE THREAD

**Issue by ChrisPices** [gravitational/teleport#53859]
Expected behavior:

From 10.10.15.12, i want to create a proxy tunnel to 10.10.15.5.
When i do `tsh proxy ssh it@debian --proxy bastion.mis.local:3080 --user ChrisPices`
This should create me a tunnel, and make me able to use PuTTY, WinSCP over tsh...

Current behavior:

On the client side, it stay locked on the SSH banner, and don't give ability to log on localhost after

> root@debian:~# tsh proxy ssh it@debian --proxy bastion.mis.local:3080 --user ChrisPices --debug
> 2025-04-09T16:22:32.730+02:00 INFO [CLIENT]    ALPN connection upgrade required for "bastion.mis.local:3080": false. client/api.go:915
> 2025-04-09T16:22:32.730+02:00 WARN [CLIENT]    [KEY AGENT] Unable to connect to SSH agent on socket "": dial unix: missing address client/api.go:4837
> 2025-04-09T16:22:32.731+02:00 INFO [KEYAGENT]  Loading SSH key for user "ChrisPices" and cluster "teleport-docker". client/keyagent.go:198
> 2025-04-09T16:22:32.732+02:00 DEBU [CLIENT]    Using provided host TacticalRMM client/api.go:1575
> 2025-04-09T16:22:32.763+02:00 DEBU  attaching new resumable connection trace_id:56e1bc6f661d3a9051121d82ff7e5d93 span_id:858e57c1100c7fd1 resumption/client.go:284
>
> SSH-2.0-Teleport
>
> 2025-04-09T16:25:32.763+02:00 DEBU  attempting periodic reconnection host_id:117b2051-faba-45b5-a8f5-cb190b38fd56 trace_id:56e1bc6f661d3a9051121d82ff7e5d93 span_id:858e57c1100c7fd1 resumption/client.go:195
> 2025-04-09T16:25:32.764+02:00 DEBU  dialing server for connection resumption host_id:117b2051-faba-45b5-a8f5-cb190b38fd56 trace_id:56e1bc6f661d3a9051121d82ff7e5d93 span_id:858e57c1100c7fd1 resumption/client.go:310
> 2025-04-09T16:25:32.800+02:00 DEBU  attaching existing resumable connection trace_id:56e1bc6f661d3a9051121d82ff7e5d93 span_id:858e57c1100c7fd1 resumption/client.go:286
> 2025-04-09T16:25:32.800+02:00 DEBU  handling new resumable connection error:[
> ERROR REPORT:
> Original Error: poll.errNetClosing use of closed network connection
> Stack Trace:
>         github.com/gravitational/teleport/lib/resumption/resumable.go:380 github.com/gravitational/teleport/lib/resumption.runResumeV1Write
>         github.com/gravitational/teleport/lib/resumption/resumable.go:169 github.com/gravitational/teleport/lib/resumption.runResumeV1Unlocking.func5
>         golang.org/x/sync@v0.12.0/errgroup/errgroup.go:78 golang.org/x/sync/errgroup.(*Group).Go.func1
>         runtime/asm_amd64.s:1700 runtime.goexit
> User Message: write loop
>         disconnection requested
>                 use of closed network connection] trace_id:56e1bc6f661d3a9051121d82ff7e5d93 span_id:858e57c1100c7fd1 resumption/client.go:292
> 

On the server side, here's the error I get (handshake error) :

> avril 09 16:29:50 TacticalRMM teleport[1767697]: 2025-04-09T16:29:50.460+02:00 DEBU [PROXY:AGE] Transport request: teleport-transport. leaseID:5 target:bastion.mis.local:3080 localCluster: targetCluster:teleport-docker reversetunnel/agent.go:549
> avril 09 16:29:50 TacticalRMM teleport[1767697]: 2025-04-09T16:29:50.478+02:00 DEBU  proceeding with connection resumption exchange resumption/server_detect.go:227
> avril 09 16:29:50 TacticalRMM teleport[1767697]: 2025-04-09T16:29:50.478+02:00 INFO  handling new resumable SSH connection resumption/server_exchange.go:92
> avril 09 16:29:50 TacticalRMM teleport[1767697]: 2025-04-09T16:29:50.478+02:00 INFO  handing resumable connection to the SSH server resumption/server_exchange.go:136
> avril 09 16:29:57 TacticalRMM teleport[1767697]: 2025-04-09T16:29:57.425+02:00 DEBU [PROXY:AGE] Ping -> 5.39.18.195:3080. leaseID:5 target:bastion.mis.local:3080 localCluster: targetCluster:teleport-docker reversetunnel/agent.go:530
> avril 09 16:30:01 TacticalRMM teleport[1767697]: 2025-04-09T16:30:01.421+02:00 WARN [SSH:NODE]  Error occurred in handshake for new SSH conn error:[use of closed network connection] remote_addr:10.10.15.12:44308 sshutils/server.go:524
> avril 09 16:30:01 TacticalRMM teleport[1767697]: 2025-04-09T16:30:01.421+02:00 INFO  resumable connection completed resumption/server_exchange.go:138
> avril 09 16:30:04 TacticalRMM teleport[1767697]: 2025-04-09T16:30:04.460+02:00 DEBU [HOSTUSERS] Target group not found, not deleting users group:teleport-system srv/usermgmt.go:553
> avril 09 16:30:19 TacticalRMM teleport[1767697]: 2025-04-09T16:30:19.037+02:00 WARN [SSH:NODE]  Error occurred in handshake for new SSH conn error:[use of closed network connection] remote_addr:10.10.15.12:59748 sshutils/server.go:524
> avril 09 16:30:19 TacticalRMM teleport[1767697]: 2025-04-09T16:30:19.038+02:00 INFO  resumable connection completed resumption/server_exchange.go:138
> avril 09 16:30:43 TacticalRMM teleport[1767697]: 2025-04-09T16:30:43.574+02:00 WARN [SSH:NODE]  Error occurred in handshake for new SSH conn error:[use of closed network connection] remote_addr:10.10.15.12:56714 sshutils/server.go:524
> avril 09 16:30:43 TacticalRMM teleport[1767697]: 2025-04-09T16:30:43.574+02:00 INFO  resumable connection completed resumption/server_exchange.go:138
> avril 09 16:30:57 TacticalRMM teleport[1767697]: 2025-04-09T16:30:57.419+02:00 DEBU [PROXY:AGE] Received discovery request: [23f610c1-e085-4f3f-951c-db559bcf7f79] leaseID:5 target:bastion.mis.local:3080 localCluster: targetCluster:teleport-docker reversetunnel/agent.go:626
> avril 09 16:32:49 TacticalRMM teleport[1767697]: 2025-04-09T16:32:49.657+02:00 DEBU [PROXY:AGE] Received discovery request: [23f610c1-e085-4f3f-951c-db559bcf7f79] leaseID:5 target:bastion.mis.local:3080 localCluster: targetCluster:teleport-docker reversetunnel/agent.go:626
> avril 09 16:32:50 TacticalRMM teleport[1767697]: 2025-04-09T16:32:50.489+02:00 DEBU [PROXY:AGE] Transport request: teleport-transport. leaseID:5 target:bastion.mis.local:3080 localCluster: targetCluster:teleport-docker reversetunnel/agent.go:549
> avril 09 16:32:50 TacticalRMM teleport[1767697]: 2025-04-09T16:32:50.507+02:00 DEBU  proceeding with connection resumption exchange resumption/server_detect.go:227
> avril 09 16:32:50 TacticalRMM teleport[1767697]: 2025-04-09T16:32:50.507+02:00 DEBU  handling new resumable connection error:[
> avril 09 16:32:50 TacticalRMM teleport[1767697]: ERROR REPORT:
> avril 09 16:32:50 TacticalRMM teleport[1767697]: Original Error: *trace.ConnectionProblemError use of closed network connection
> avril 09 16:32:50 TacticalRMM teleport[1767697]: Stack Trace:
> avril 09 16:32:50 TacticalRMM teleport[1767697]:         github.com/gravitational/teleport/api@v0.0.0/utils/sshutils/chconn.go:141 github.com/gravitational/teleport/api/utils/sshutils.(*ChConn).Read
> avril 09 16:32:50 TacticalRMM teleport[1767697]:         bufio/bufio.go:110 bufio.(*Reader).fill
> avril 09 16:32:50 TacticalRMM teleport[1767697]:         bufio/bufio.go:269 bufio.(*Reader).ReadByte
> avril 09 16:32:50 TacticalRMM teleport[1767697]:         github.com/gravitational/teleport/lib/multiplexer/wrappers.go:72 github.com/gravitational/teleport/lib/multiplexer.(*Conn).ReadByte
> avril 09 16:32:50 TacticalRMM teleport[1767697]:         encoding/binary/varint.go:134 encoding/binary.ReadUvarint
> avril 09 16:32:50 TacticalRMM teleport[1767697]:         github.com/gravitational/teleport/lib/resumption/resumable.go:221 github.com/gravitational/teleport/lib/resumption.runResumeV1Read
> avril 09 16:32:50 TacticalRMM teleport[1767697]:         github.com/gravitational/teleport/lib/resumption/resumable.go:157 github.com/gravitational/teleport/lib/resumption.runResumeV1Unlocking.func4
> avril 09 16:32:50 TacticalRMM teleport[1767697]:         golang.org/x/sync@v0.12.0/errgroup/errgroup.go:78 golang.org/x/sync/errgroup.(*Group).Go.func1
> avril 09 16:32:50 TacticalRMM teleport[1767697]:         runtime/asm_amd64.s:1700 runtime.goexit
> avril 09 16:32:50 TacticalRMM teleport[1767697]: User Message: read loop
> avril 09 16:32:50 TacticalRMM teleport[1767697]:         reading ack
> avril 09 16:32:50 TacticalRMM teleport[1767697]:                 use of closed network connection] resumption/server_exchange.go:144
> avril 09 16:32:57 TacticalRMM teleport[1767697]: 2025-04-09T16:32:57.420+02:00 DEBU [PROXY:AGE] Received discovery request: [23f610c1-e085-4f3f-951c-db559bcf7f79] leaseID:5 target:bastion.mis.local:3080 localCluster: targetCluster:teleport-docker reversetunnel/agent.go:626

And on the teleport side, here is what I have : 

> 2025-04-09T14:29:50.459Z DEBU [PROXY:SER] Dialing from: "10.10.15.12:41586" to: "@local-node". trace.fields:map[cluster:teleport-docker] reversetunnel/localsite.go:310
> 2025-04-09T14:29:50.459Z DEBU [PROXY:SER] Tunnel dialing to 117b2051-faba-45b5-a8f5-cb190b38fd56.teleport-docker, client source 10.10.15.12:41586 trace.fields:map[cluster:teleport-docker] reversetunnel/localsite.go:502
> 2025-04-09T14:29:50.459Z DEBU [PROXY:SER] Connecting to 10.10.15.5:27213 through tunnel. trace.fields:map[cluster:teleport-docker] reversetunnel/localsite.go:945
> 2025-04-09T14:29:50.477Z DEBU [PROXY:SER] Succeeded dialing from: "10.10.15.12:41586" to: "@local-node". trace.fields:map[cluster:teleport-docker] reversetunnel/localsite.go:316
> 2025-04-09T14:29:57.434Z DEBU [PROXY:SER] Ping <- 10.10.15.5:27213 addr:10.10.15.5:27213 latency:8.906542ms serverID:117b2051-faba-45b5-a8f5-cb190b38fd56.teleport-docker trace.fields:map[cluster:teleport-docker] reversetunnel/localsite.go:857
> 2025-04-09T14:30:31.135Z DEBU [AUTH:1]    Reconciling autoupdate_agent_rollout pid:1.1 component:rollout-controller rollout/controller.go:126
> 2025-04-09T14:30:52.185Z DEBU [AUTH:COMP] acquiring semaphore in order to complete uploads server_id:23f610c1-e085-4f3f-951c-db559bcf7f79 events/complete.go:185
> 2025-04-09T14:30:57.418Z DEBU [DISCOVERY] Sending discovery request with proxies [23f610c1-e085-4f3f-951c-db559bcf7f79] to 10.10.15.5:27213. reversetunnel/conn.go:285
> 2025-04-09T14:31:23.791Z DEBU [AUTH:1]    Reconciling autoupdate_agent_rollout pid:1.1 component:rollout-controller rollout/controller.go:126
> 2025-04-09T14:32:15.393Z DEBU [AUTH:1]    Reconciling autoupdate_agent_rollout pid:1.1 component:rollout-controller rollout/controller.go:126
> 2025-04-09T14:32:49.655Z DEBU  List of known resources updated resources:[23f610c1-e085-4f3f-951c-db559bcf7f79] services/watcher.go:865
> 2025-04-09T14:32:49.655Z DEBU [DISCOVERY] Sending discovery request with proxies [23f610c1-e085-4f3f-951c-db559bcf7f79] to 10.10.15.5:27213. reversetunnel/conn.go:285
> 2025-04-09T14:32:50.487Z DEBU [PROXY:SER] Dialing from: "10.10.15.12:41586" to: "@local-node". trace.fields:map[cluster:teleport-docker] reversetunnel/localsite.go:310
> 2025-04-09T14:32:50.487Z DEBU [PROXY:SER] Tunnel dialing to 117b2051-faba-45b5-a8f5-cb190b38fd56.teleport-docker, client source 10.10.15.12:41586 trace.fields:map[cluster:teleport-docker] reversetunnel/localsite.go:502
> 2025-04-09T14:32:50.487Z DEBU [PROXY:SER] Connecting to 10.10.15.5:27213 through tunnel. trace.fields:map[cluster:teleport-docker] reversetunnel/localsite.go:945
> 2025-04-09T14:32:50.505Z DEBU [PROXY:SER] Succeeded dialing from: "10.10.15.12:41586" to: "@local-node". trace.fields:map[cluster:teleport-docker] reversetunnel/localsite.go:316
> 2025-04-09T14:32:57.419Z DEBU [DISCOVERY] Sending discovery request with proxies [23f610c1-e085-4f3f-951c-db559bcf7f79] to 10.10.15.5:27213. reversetunnel/conn.go:285
> 2025-04-09T14:33:10.990Z DEBU [AUTH:1]    Reconciling autoupdate_agent_rollout pid:1.1 component:rollout-controller rollout/controller.go:126

I made a tcpdump on the remote server i want to up the tunnel, and as we can see, they communicate well : 

> listening on any, link-type LINUX_SLL2 (Linux cooked v2), snapshot length 262144 bytes
> 16:39:38.272808 ens19 In  IP bastion.mis.local.38492 > 10.10.15.5.3022: Flags [F.], seq 3186711962, ack 1905054822, win 501, options [nop,nop,TS val 1070913917 ecr 2466836465], length 0
> 16:39:38.272874 ens19 Out IP 10.10.15.5.3022 > bastion.mis.local.38492: Flags [F.], seq 1, ack 1, win 501, options [nop,nop,TS val 2466843199 ecr 1070913917], length 0
> 16:39:38.272963 ens19 In  IP bastion.mis.local.38492 > 10.10.15.5.3022: Flags [.], ack 2, win 501, options [nop,nop,TS val 1070913917 ecr 2466843199], length 0
> 16:39:38.894662 ens19 In  IP bastion.mis.local.38504 > 10.10.15.5.3022: Flags [S], seq 3062936988, win 64240, options [mss 1460,sackOK,TS val 1070914538 ecr 0,nop,wscale 7], length 0
> 16:39:38.894685 ens19 Out IP 10.10.15.5.3022 > bastion.mis.local.38504: Flags [S.], seq 1462070313, ack 3062936989, win 65160, options [mss 1460,sackOK,TS val 2466843821 ecr 1070914538,nop,wscale 7], length 0
> 16:39:38.894762 ens19 In  IP bastion.mis.local.38504 > 10.10.15.5.3022: Flags [.], ack 1, win 502, options [nop,nop,TS val 1070914539 ecr 2466843821], length 0
> 16:39:38.894905 ens19 Out IP 10.10.15.5.3022 > bastion.mis.local.38504: Flags [P.], seq 1:154, ack 1, win 510, options [nop,nop,TS val 2466843821 ecr 1070914539], length 153
> 16:39:38.894943 ens19 In  IP bastion.mis.local.38504 > 10.10.15.5.3022: Flags [P.], seq 1:1157, ack 1, win 502, options [nop,nop,TS val 1070914539 ecr 2466843821], length 1156
> 16:39:38.894947 ens19 Out IP 10.10.15.5.3022 > bastion.mis.local.38504: Flags [.], ack 1157, win 501, options [nop,nop,TS val 2466843821 ecr 1070914539], length 0
> 16:39:38.894970 ens19 In  IP bastion.mis.local.38504 > 10.10.15.5.3022: Flags [.], ack 154, win 501, options [nop,nop,TS val 1070914539 ecr 2466843821], length 0
> 16:39:38.895886 ens19 In  IP bastion.mis.local.38504 > 10.10.15.5.3022: Flags [P.], seq 1157:1165, ack 154, win 501, options [nop,nop,TS val 1070914540 ecr 2466843821], length 8
> 16:39:38.895894 ens19 Out IP 10.10.15.5.3022 > bastion.mis.local.38504: Flags [.], ack 1165, win 501, options [nop,nop,TS val 2466843822 ecr 1070914540], length 0
> 16:39:38.895903 ens19 In  IP bastion.mis.local.38504 > 10.10.15.5.3022: Flags [P.], seq 1165:1184, ack 154, win 501, options [nop,nop,TS val 1070914540 ecr 2466843821], length 19
> 16:39:38.895904 ens19 In  IP bastion.mis.local.38504 > 10.10.15.5.3022: Flags [P.], seq 1184:1249, ack 154, win 501, options [nop,nop,TS val 1070914540 ecr 2466843821], length 65
> 16:39:38.895904 ens19 In  IP bastion.mis.local.38504 > 10.10.15.5.3022: Flags [P.], seq 1249:1250, ack 154, win 501, options [nop,nop,TS val 1070914540 ecr 2466843821], length 1
> 16:39:38.895905 ens19 Out IP 10.10.15.5.3022 > bastion.mis.local.38504: Flags [.], ack 1184, win 501, options [nop,nop,TS val 2466843822 ecr 1070914540], length 0
> 16:39:38.895910 ens19 Out IP 10.10.15.5.3022 > bastion.mis.local.38504: Flags [.], ack 1249, win 501, options [nop,nop,TS val 2466843822 ecr 1070914540], length 0
> 16:39:38.895913 ens19 Out IP 10.10.15.5.3022 > bastion.mis.local.38504: Flags [.], ack 1250, win 501, options [nop,nop,TS val 2466843822 ecr 1070914540], length 0
> 16:39:38.896376 ens19 Out IP 10.10.15.5.3022 > bastion.mis.local.38504: Flags [P.], seq 154:156, ack 1250, win 501, options [nop,nop,TS val 2466843822 ecr 1070914540], length 2
> 16:39:38.896388 ens19 Out IP 10.10.15.5.3022 > bastion.mis.local.38504: Flags [P.], seq 156:174, ack 1250, win 501, options [nop,nop,TS val 2466843822 ecr 1070914540], length 18
> 16:39:38.896451 ens19 In  IP bastion.mis.local.38504 > 10.10.15.5.3022: Flags [.], ack 174, win 501, options [nop,nop,TS val 1070914540 ecr 2466843822], length 0
> 16:39:38.896666 ens19 In  IP bastion.mis.local.38504 > 10.10.15.5.3022: Flags [P.], seq 1250:1252, ack 174, win 501, options [nop,nop,TS val 1070914540 ecr 2466843822], length 2
> 16:39:38.938480 ens19 Out IP 10.10.15.5.3022 > bastion.mis.local.38504: Flags [.], ack 1252, win 501, options [nop,nop,TS val 2466843865 ecr 1070914540], length 0
> 16:39:54.049930 ens19 In  IP bastion.mis.local.38504 > 10.10.15.5.3022: Flags [.], ack 174, win 501, options [nop,nop,TS val 1070929694 ecr 2466843865], length 0
> 16:39:54.049942 ens19 Out IP 10.10.15.5.3022 > bastion.mis.local.38504: Flags [.], ack 1252, win 501, options [nop,nop,TS val 2466858976 ecr 1070914540], length 0

My teleport is dockerized, on a VM inside a Proxmox cluster. The VM has an public IP, so the Teleport container is direct exposed to internet.

My docker-compose.yml : 

> version: '3.7'
> 
> services:
>   teleport:
>     image: public.ecr.aws/gravitational/teleport-distroless-debug:17.3.4
>     container_name: teleport
>     ports:
>       - "3080:3080"
>       - "3021:3021"
>       - "3022:3022"
>       - "3023:3023"
>       - "3024:3024"
>       - "3025:3025"
>       - "3026:3026"
>     volumes:
>       - ./config:/etc/teleport
>       - ./data:/var/lib/teleport
>       - ./certs:/etc/teleport/certs
>     entrypoint: ["teleport"]
>     command: ["start", "--config=/etc/teleport/teleport.yaml"]
>     restart: unless-stopped

My teleport.yaml : 

> teleport:
>   nodename: teleport-docker
>   data_dir: /var/lib/teleport
>   log:
>     output: stderr
>     severity: DEBUG
> 
> auth_service:
>   enabled: true
>   listen_addr: "0.0.0.0:3025"
>   proxy_listener_mode: multiplex
>   cluster_name: "teleport-docker"
> 
> ssh_service:
>   enabled: true
> 
> proxy_service:
>   enabled: true
>   listen_addr: "0.0.0.0:3023"
>   web_listen_addr: "0.0.0.0:3080"
>   https_key_file: /etc/teleport/certs/tls.key
>   https_cert_file: /etc/teleport/certs/tls.crt
>   public_addr: bastion.mis.local:3080

tsh ssh is working well, from Windows client, tsh client, also linux and web..
But i'm litteraly not able to create a proxy tunnel. Tryied to find a similary issue on the github but looks like i'm the only one...

Already checked the firewall rules, everything's good, and even if i open all the ports and accept everything, it still not works.

Tryied to downgrade version, not working too.

Teleport version : 17.3.4
Tsh version : 17.3.4

Fell free to ask me more informations !
Have a great day.

>
