### ISSUE TITLE
Using `tsh proxy` inside teleport container - no access from local machine or other containers

### ISSUE THREAD

**Issue by wszychta** [gravitational/teleport#35963]
Story:
We have use case where we need to access resources behind Teleport on local development environment. In most cases installing `tsh` and `tctl` is solving our issue, but sometime we need to access such resource from docker container. Because of that I was trying to use `public.ecr.aws/gravitational/teleport:14.1.5` container to setup app proxy and grant access to resources behind teleport for both local machine and other containers.

Also I have verified that proxy is working with:
- Entered inside container with `docker exec --ti CONTAINER_ID /bin/bash`
- Installed curl with `apt update && apt install curl`
- I was able to get application content after running command `curl http://localhost:8100`

Expected behavior:
After running `curl` command I should get resource available behind Teleport.

Current behavior:
- From local machine to app proxy container: `curl` is giving me error: `curl: (56) Recv failure: TCP connection reset by peer`
- From one container to another in the same network: `curl` is giving me error: `curl: (7) Failed to connect to teleport-proxy port 8100 after 0 ms: Couldn't connect to server`

Bug details:
- Teleport version: 14.1.5
- Recreation steps:
  - Create an APP behind Teleport - for example single nginx container
  - Login to Teleport from local command line `tsh login --proxy=$TELEPORT_PROXY --user=$USERNAME`
  - Login to an app behind Teleport `tsh apps login $APP_NAME --proxy $TELEPORT_PROXY`
  - Create docker compose file:
  ```
  services:
    teleport-proxy:
      image: public.ecr.aws/gravitational/teleport:14.1.5
      ports:
        - 8100:8100
      volumes:
        - /home/USERNAME/.tsh:/root/.tsh
      environment:
        - APP_NAME=$APP_NAME
      entrypoint: tsh proxy --debug app $APP_NAME --port 8100
    other-container:
      depends_on:
        - teleport-admin-proxy
      image: quay.io/curl/curl:latest
      entrypoint: watch curl -v http://teleport-proxy:8100
  ```
  - Run `docker compose up` to start both containers
  - Try to connect to app via a new Proxy app container from local machine to other container
- Debug logs:
  - Most of the time there are no logs other than already described above errors.
  - Also I have checked inside teleport container traffic with `tcpdump port 8100`:
    - No logs when I have installed curl inside teleport container and used it for testing
    - Traffic from one to another container
    ```
    13:33:53.124160 IP teleport-other-container-1.teleport_default.57028 > 73a9cd2dc0e6.8100: Flags [S], seq 3412874403, win 64240, options [mss 1460,sackOK,TS val 813436280 ecr 0,nop,wscale 7], length 0
    13:33:53.124180 IP 73a9cd2dc0e6.8100 > teleport-other-container-1.teleport_default.57028: Flags [R.], seq 0, ack 3412874404, win 0, length 0
    13:33:55.133531 IP teleport-other-container-1.teleport_default.57030 > 73a9cd2dc0e6.8100: Flags [S], seq 68282900, win 64240, options [mss 1460,sackOK,TS val 813438290 ecr 0,nop,wscale 7], length 0
    13:33:55.133541 IP 73a9cd2dc0e6.8100 > teleport-other-container-1.teleport_default.57030: Flags [R.], seq 0, ack 68282901, win 0, length 0
    ```
    - Traffic from local machine to proxy app container
    ```
    12:44:57.820135 IP local-computer.45386 > 22a7ccbc1120.8100: Flags [S], seq 773820103, win 64240, options [mss 1460,sackOK,TS val 2156338261 ecr 0,nop,wscale 7], length 0
    12:44:57.820160 IP 22a7ccbc1120.8100 > local-computer.45386: Flags [R.], seq 0, ack 773820104, win 0, length 0
    12:44:58.486691 IP local-computer.45390 > 22a7ccbc1120.8100: Flags [S], seq 507768625, win 64240, options [mss 1460,sackOK,TS val 2156338928 ecr 0,nop,wscale 7], length 0
    12:44:58.486717 IP 22a7ccbc1120.8100 > local-computer.45390: Flags [R.], seq 0, ack 507768626, win 0, length 0
    ```
