### ISSUE TITLE
DynamoDB not respecting HTTPS_PROXY

### ISSUE THREAD

**Issue by kgtw** [gravitational/teleport#4261]
### Description
When running teleport in a restricted environment where public egress needs to traverse via a proxy, dynamodb does not respect the environment variables `HTTPS_PROXY` or `HTTP_PROXY`.

**What you expected to happen**:

DynamoDB request to be sent via the proxy configured in the env variables.

**How to reproduce it (as minimally and precisely as possible)**:

Run teleport with proxy environment variables

```
NO_PROXY="169.254.169.254/32" HTTPS_PROXY="http://proxy:1234" HTTP_PROXY="http://proxy:1234" /usr/local/bin/teleport start --config=/etc/teleport/teleport.yaml
```

View your configured http proxy logs, you will not see any requests received from teleport trying to access dynamodb.

Running a tcpdump filtering out local VPC traffic and catching any requests on 443, we see that teleport is trying to talk to dynamodb directly and not via the proxy.

```
$ tcpdump -i ens5 dst port 443 and dst net not 172.31.0.0/16
18:47:18.434207 IP ip-172-31-201-157.eu-central-1.compute.internal.53936 > dynamodb.eu-central-1.amazonaws.com.https: Flags [S], seq 3083593459, win 62727, options [mss 8961,nop,nop,sackOK,nop,wscale 7], length 0
18:47:19.450643 IP ip-172-31-201-157.eu-central-1.compute.internal.53936 > dynamodb.eu-central-1.amazonaws.com.https: Flags [S], seq 3083593459, win 62727, options [mss 8961,nop,nop,sackOK,nop,wscale 7], length 0
18:47:21.466651 IP ip-172-31-201-157.eu-central-1.compute.internal.53936 > dynamodb.eu-central-1.amazonaws.com.https: Flags [S], seq 3083593459, win 62727, options [mss 8961,nop,nop,sackOK,nop,wscale 7], length 0
```

Teleport logs, hang once the attempt to connect to dynamodb is made and the server never becomes ready.

```
DEBU [SQLITE]    Connected to: file:/var/lib/teleport/proc/sqlite.db?_busy_timeout=10000&_sync=OFF, poll stream period: 1s lite/lite.go:173
DEBU [SQLITE]    Synchronous: 0, busy timeout: 10000 lite/lite.go:218
DEBU [PROC]      Adding service to supervisor. service:readyz.monitor sync/mutex.go:74
INFO [PROC:1]    Service diag is creating new listener on 0.0.0.0:3000. service/signals.go:215
INFO [DIAG:1]    Starting diagnostic service on 0.0.0.0:3000. service/service.go:1778
DEBU [PROC]      Adding service to supervisor. service:diagnostic.service sync/mutex.go:74
DEBU [PROC]      Adding service to supervisor. service:diagnostic.shutdown sync/mutex.go:74
DEBU [KEYGEN]    SSH cert authority is going to pre-compute 25 keys. native/native.go:104
DEBU [PROC:1]    Using dynamodb backend. service/service.go:2352
INFO [DYNAMODB]  Initializing backend. Table: "my-debug-cluster", poll streams every 0s. dynamo/dynamodbbk.go:180
```

I believe this may be the offending line, where the transport is initialised but not sourced by the defaults meaning that the proxy env variables are never used.
https://github.com/gravitational/teleport/blob/v4.3.5/lib/backend/dynamo/dynamodbbk.go#L223-L229

Something like this might fix it?

```
        tr, ok := http.DefaultTransport.(*http.Transport)
	if !ok {
		return nil, trace.BadParameter("unable to get default transport")
	}
	tr.MaxIdleConns = defaults.HTTPMaxIdleConns
	tr.MaxIdleConnsPerHost = defaults.HTTPMaxConnsPerHost
	httpClient := &http.Client{
		Transport: tr,
	}
	sess.Config.HTTPClient = httpClient
```

### Environment
* Teleport version (use `teleport version`): Teleport Enterprise v4.3.5git:v4.3.5-0-g122349e78 go1.13.2
* Tsh version (use `tsh version`):  Teleport v4.3.5 git:v4.3.5-0-g122349e78 go1.13.2
* OS (e.g. from `/etc/os-release`): Ubuntu 18.04.5 LTS
* Where are you running Teleport? (e.g. AWS, GCP, Dedicated Hardware): AWS

**Browser environment**

* Browser Version (for UI-related issues):
* Install tools:
* Others:

**Relevant Debug Logs If Applicable**

* `tsh --debug`
* `teleport --debug`

┆Issue is synchronized with this [Asana task](https://app.asana.com/0/1190134506177097/1190888628006173) by [Unito](https://www.unito.io/learn-more)

**Comment by webvictim** [comment]
Fixed by #4271
